,index,documents,num_comments,score,title,tldr,ups,upvote_ratio,LCS,COSINE,TFIDF
14,21068,"university exams, fun xe2 x84 xa2 right?i had no idea if the exam was written on paper, oral, multiple choice, nothing. it s an elective so i did study but never got really immersed in it. nothing clicks even after i see that it ll be in a computer room. it was multiple choice on pc. you need your uni account login for that, from which i have two, and because security reasons, have to change both every few months. normally i know both, or get it right after a few times.so there i was, sitting before the monitor, trying to remember just what on earth did i change it the last time. prof is really nice about it, tells me to call someone. but i don t know my flatmate s phone number, had to get it from the landlord. flatmate isn t home.since there s no other way around it, the uni services aren t around in the afternoon either, my flat is too far to make a round trip, i ended up coming home but thankfully not getting any penalty for not participating.checked the password a few minutes ago, still wondering how i ended up picking something so easy yet so obscure. ",2,0,not using common sense w a login ,"went to exam, was on pc, forgot my login, had to leave because there was no way to get the password ",0,0.330000013,"university exams, fun xe2 x84 xa2 right i had no idea if the exam was written on paper, oral, multiple choice, nothing.","normally i know both, or get it right after a few times.so there i was, sitting before the monitor, trying to remember just what on earth did i change it the last time.","university exams, fun xe2 x84 xa2 right i had no idea if the exam was written on paper, oral, multiple choice, nothing."
15,38859,"i m not telling when this happened. ha!so, last year i bought some skid plates. they are big heavy steel plates that get bolted to the bottom of a truck or jeep to protect it from rocks while off-roading. there are 2 of them, weighing 125 lbs. i figure, that s heavy, but not that heavy. i lifted them over my head and promptly lost my balance. here s what went through my head:there s no way that i m going to let these steel plates which are designed to hold the weight of a large off-road vehicle hit the concrete and get scratched . so, i didn t let go. they landed edge first on my right hand, which had the neat effect of concentrating 125 lbs of steel from a height of about 6.5 feet in the air right on the tender little bones of my hand. boy i tell you what, i have never felt pain like that before. never. never in my life. i went inside and laid on my parent s couch and said more curse words than my mother would care to hear while swatting at her stupid little chihuahua it s not stupid, actually, she s a very nice dog, but she is very licky and i was in no mood . i went back to work to finish my shift but i hurt really really bad and i thought that maybe my hand might be broken. i went to the urgent care place heck with er, too expensive and asked pretty-please if i might see a doctor, and soon, because i was registering a 9.5 on the pain scale. the nurse at the front desk asked me, what did you punch? i said, your face if you don t hurry up. just kidding, i told her what actually happened and i hoped that she felt dumb for assuming that i punched something.they did an x-ray and i had no broken bones. ut it hurts something fierce! i said. ruised bones hurt more, they replied. well, that s good news. doc told me to see another doc in a day or something like that, i don t remember, because the swelling could kill nerves and screw up my hand, etc. details are fuzzy.anyways, here i am, precisely a year later. my hand retains most of it s function that it was born with except for 2 things: 1 i am permanently doing the spock live long and prosper thing. i can t bring ring and index fingers together without help.2 it s hard to describe, but i have very little lateral strength in my right hand. ut why is lateral strength important, u oltorf the destroyer? you might be asking now. well, i will put this as gently as i can, since we are in polite company. when you go poo, you must clean yourself. that is when this is important. i have to use my left hand, which is not as dexterous and has caused several unfortunate mishaps. thank you for reading, and remember, don t be stupid. ",1,0,my hand pretty bad ,"a very mysterious length of time ago, i dropped steel plates on my hand from over my head. hilarity ensues, bathroom style. ",0,0.5,"here 's what went through my head there 's no way that i 'm going to let these steel plates which are designed to hold the weight of a large off-road vehicle hit the concrete and get scratched . they landed edge first on my right hand, which had the neat effect of concentrating 125 lbs of steel from a height of about 6.5 feet in the air right on the tender little bones of my hand. i went inside and laid on my parent 's couch and said more curse words than my mother would care to hear while swatting at her stupid little chihuahua it 's not stupid, actually, she 's a very nice dog, but she is very licky and i was in no mood . just kidding, i told her what actually happened and i hoped that she felt dumb for assuming that i punched something.they did an x-ray and i had no broken bones. doc told me to see another doc in a day or something like that, i don 't remember, because the swelling could kill nerves and screw up my hand, etc. i can 't bring ring and index fingers together without help.2 it 's hard to describe, but i have very little lateral strength in my right hand.","here 's what went through my head there 's no way that i 'm going to let these steel plates which are designed to hold the weight of a large off-road vehicle hit the concrete and get scratched . i went inside and laid on my parent 's couch and said more curse words than my mother would care to hear while swatting at her stupid little chihuahua it 's not stupid, actually, she 's a very nice dog, but she is very licky and i was in no mood . i went back to work to finish my shift but i hurt really really bad and i thought that maybe my hand might be broken. i went to the urgent care place heck with er, too expensive and asked pretty-please if i might see a doctor, and soon, because i was registering a 9.5 on the pain scale. doc told me to see another doc in a day or something like that, i don 't remember, because the swelling could kill nerves and screw up my hand, etc. i can 't bring ring and index fingers together without help.2 it 's hard to describe, but i have very little lateral strength in my right hand.","here 's what went through my head there 's no way that i 'm going to let these steel plates which are designed to hold the weight of a large off-road vehicle hit the concrete and get scratched . they landed edge first on my right hand, which had the neat effect of concentrating 125 lbs of steel from a height of about 6.5 feet in the air right on the tender little bones of my hand. i went inside and laid on my parent 's couch and said more curse words than my mother would care to hear while swatting at her stupid little chihuahua it 's not stupid, actually, she 's a very nice dog, but she is very licky and i was in no mood . just kidding, i told her what actually happened and i hoped that she felt dumb for assuming that i punched something.they did an x-ray and i had no broken bones. i can 't bring ring and index fingers together without help.2 it 's hard to describe, but i have very little lateral strength in my right hand. ut why is lateral strength important, u oltorf the destroyer "
16,4534,"this happened yesterday. i am currently on spring break. my family and some friends went skiing for the week. yesterday i was on the slopes, and to clarify why this happened, i recently started getting more confident with park skiing. i can do rails, higher jumps, etc. anyway, yesterday i took a detour into a jump that is a high drop but fine as long as you go for it and land on the downward slope under the jump. i had done it before but for some reason swerved at the last minute and still hit the jump, which caused me to plummet a good 8-10 feet before landing as my knee connected with my jaw. i bit open my lip and was bleeding a lot because of the many blood vessels there. my teeth also were knocked slightly loose so i have to wear my retainer non stop for a week instead of just nightly, and i have a lasting headache. to add insult to injury, as i was skiing away dazed and spitting blood, i forgot i as wearing a face mask and thus proceeded to slit a large glop of blood and saliva right into my mask which of course dripped down my jacket. ",2,0,while skiing ,swerve. ,0,0.5,"yesterday i was on the slopes, and to clarify why this happened, i recently started getting more confident with park skiing. anyway, yesterday i took a detour into a jump that is a high drop but fine as long as you go for it and land on the downward slope under the jump.","anyway, yesterday i took a detour into a jump that is a high drop but fine as long as you go for it and land on the downward slope under the jump. i had done it before but for some reason swerved at the last minute and still hit the jump, which caused me to plummet a good 8-10 feet before landing as my knee connected with my jaw.","this happened yesterday. yesterday i was on the slopes, and to clarify why this happened, i recently started getting more confident with park skiing."
17,31793,"this is my freshly made throwaway account because the vast majority of my friends use reddit and i don t feel like disclosing my fuck ups to them. so around 2 am this morning, i was skimming through youtube, absent mindedly playing with my balls like most men do, when i got a text from my female friend. i ve pretty much grown up with this girl and used to have a thing for her a while back but that s long since past. she texted me asking if i wanted to get dinner later tonight at some hole in the wall restaurant we eat at all the time. now, you need to know that she gets around a fair amount and is currently seeing this dude named devin. i call him devin because that s his real name. no fucks given. as we all know, no good decisions happen after midnight so i jokingly said why don t you just go with devin instead . there was a long amount of time about 20 minutes before she responded again saying fine. i think i will that was the last i heard from her. no big deal. i went to bed soon after, went to class around 10 i commute to my university and got home at 3 this afternoon. around 3, my sister, who is 18 and a senior in highschool, came home with this guy that she s pretty into. my sister doesn t get around much and is pretty shy so her having a guy that likes her back is a pretty big deal. well, new guy is sitting in the living room talking to my mom about politics or some shit and my sister goes into the bathroom. she emerges 5 minutes later and heads back into the living room. i walk in to go pee when this unbearable stench of shit hits me like a brick made from a neutron star. since my sister and i have a healthy sibling relationship, we mess with eachother and make fun of each other a lot so i yell downstairs damn sis, for a lightning shit, you sure tore it up in here. i heard the new dude start laughing hysterically and my mom gasp. i hear footsteps thunder up the stairs and there s my sister red faced and tearing up. she immediately slaps me in the face and starts screaming at me about how i humiliated her and how this guy probably thinks she s a complete pig now. remember, she s screaming so he can hear everything she s saying. she then proceeds to start crying like crazy and sprints back downstairs, tripping and falling down the last few, which made her cry even more. my mom comes up stairs and tells me to go in my room and not come out till my sister calms down. i decide it s better to leave the house rather than deal with this. so i left and went and got some beers and headed to my buddies house to joke about this whole situation with him. it was at this time that i got 3 texts simultaneously. first was from my sister calling me an asshole. yeah whatever sis. second was from my mom saying that i probably shouldn t come home for a few hours because my sister is pretty upset and new guy doesn t really know how to handle this. my sisters overly sensitive so i m not surprised. but the third one is what really added salt to the wound. remember that girl i mentioned earlier? well she texted me saying you know, when i asked you if you wanted to go to dinner, it s because i wanted to try to start a relationship with you. but apparently you re too insensitive to see that i m now sitting on my friends couch just silently re-evaluating my life while he s playing destiny, still make poop jokes about my sister. ",2,0,fucking up twice in one day ,"destroyed my sister s self esteem in one sentence, mom won t let me come home, and i missed out on a potentially amazing relationship. ",0,0.5,"my sister doesn 't get around much and is pretty shy so her having a guy that likes her back is a pretty big deal. well, new guy is sitting in the living room talking to my mom about politics or some shit and my sister goes into the bathroom. since my sister and i have a healthy sibling relationship, we mess with eachother and make fun of each other a lot so i yell downstairs damn sis, for a lightning shit, you sure tore it up in here.  she then proceeds to start crying like crazy and sprints back downstairs, tripping and falling down the last few, which made her cry even more. second was from my mom saying that i probably shouldn 't come home for a few hours because my sister is pretty upset and new guy doesn 't really know how to handle this. well she texted me saying you know, when i asked you if you wanted to go to dinner, it 's because i wanted to try to start a relationship with you. but apparently you 're too insensitive to see that i 'm now sitting on my friends couch just silently re-evaluating my life while he 's playing destiny, still make poop jokes about my sister.'","i 've pretty much grown up with this girl and used to have a thing for her a while back but that 's long since past. as we all know, no good decisions happen after midnight so i jokingly said why don 't you just go with devin instead . my sister doesn 't get around much and is pretty shy so her having a guy that likes her back is a pretty big deal. she then proceeds to start crying like crazy and sprints back downstairs, tripping and falling down the last few, which made her cry even more. so i left and went and got some beers and headed to my buddies house to joke about this whole situation with him. second was from my mom saying that i probably shouldn 't come home for a few hours because my sister is pretty upset and new guy doesn 't really know how to handle this. well she texted me saying you know, when i asked you if you wanted to go to dinner, it 's because i wanted to try to start a relationship with you.","around 3, my sister, who is 18 and a senior in highschool, came home with this guy that she 's pretty into. my sister doesn 't get around much and is pretty shy so her having a guy that likes her back is a pretty big deal. well, new guy is sitting in the living room talking to my mom about politics or some shit and my sister goes into the bathroom. i heard the new dude start laughing hysterically and my mom gasp. my mom comes up stairs and tells me to go in my room and not come out till my sister calms down. second was from my mom saying that i probably shouldn 't come home for a few hours because my sister is pretty upset and new guy doesn 't really know how to handle this. well she texted me saying you know, when i asked you if you wanted to go to dinner, it 's because i wanted to try to start a relationship with you."
18,4533,"i was in a video game btw, and this happened yesterday.i was with my friend and we were talking about our mount and blade regiment. i was playing rainbow 6 siege and i was rook, the guy with the armor plates. i am also sick.one of my teammates asked me to put down the armor, but i was sick. instead of doing my job, i shot him in the head. i had coughed and my elbow hit the fire button. my sick brain thought that he was my friend, so i said in the chat, get meemayed on. which got him so mad he quit.i then realized what i had done and put down my armor. then, as everyone ran towards it, i decided to sneeze, hitting the g key, which threw an impact. not realizing what i had done, i pressed g, trying to throw an impact at a wall. i killed myself, and three others.i got a 1 week ban edit:not c4, impact. ",5,0,killing my team ,i killed my entire team with an impact while being sick and confused. ,0,0.5299999710000001,"which got him so mad he quit.i then realized what i had done and put down my armor. not realizing what i had done, i pressed g, trying to throw an impact at a wall.","i am also sick.one of my teammates asked me to put down the armor, but i was sick. then, as everyone ran towards it, i decided to sneeze, hitting the g key, which threw an impact.","i am also sick.one of my teammates asked me to put down the armor, but i was sick. which got him so mad he quit.i then realized what i had done and put down my armor."
19,31790,"tifu, this was the weekend, but i was just informed that that was a huge fuck up. on friday i went to a concert and after the show i met a few people at a bar and drinking turned into drugs. cocaine, ecstasy, mushrooms then on saturday i went to a friend s party and i only planned on drinking, but peer pressure turned into strapping on my snow boots, ecstasy and acid. i started an emt class this week and i have to take a drug test just to be in the class. i think i m ducked, but i m not sure what the ecstasy will show up as or if it s even in my system. both nights the ecstacy we re mollies so i have no idea what s going to happen. i rarely do drugs too... i just felt like partying hard this weekend. ",2,0,caving into peer pressure ,"went to party, did drugs, found out i have to take a drug test. ",0,0.400000006," cocaine, ecstasy, mushrooms then on saturday i went to a friend's party and i only planned on drinking, but peer pressure turned into strapping on my snow boots, ecstasy and acid.",i rarely do drugs too... i just felt like partying hard this weekend. ," cocaine, ecstasy, mushrooms then on saturday i went to a friend's party and i only planned on drinking, but peer pressure turned into strapping on my snow boots, ecstasy and acid."
20,9,"i travel often, such that i don t want to bring my expensive 40 electric tooth brush with me when i m only staying 2 nights with my so. they live in another state so i ll come for weekends, they ll come visit too, etc. so a 2 night stay? i bought one of those old fashioned tooth brushes URL that look like this. nothing happens, i use my oldie toothbrush for several days until, the morning i leave, i sense something is off. i asked my so why my toothbrush tastes bad and why i feel i have a sore throat coming on. she asks which is my toothbrush and when i show her my oldie brush, to which she denied that was my brush, saying that she uses that brush to clean the grout around the toilet. she apparently uses the same exact old type of brush to clean the grout on her tiled floor. here comes strep throat for me. ",19,75,buying a blue toothbrush. ,i licked the floor of the toilet. for several days. ,75,0.949999988,"she asks which is my toothbrush and when i show her my oldie brush, to which she denied that was my brush, saying that she uses that brush to clean the grout around the toilet.","nothing happens, i use my oldie toothbrush for several days until, the morning i leave, i sense something is off.","she asks which is my toothbrush and when i show her my oldie brush, to which she denied that was my brush, saying that she uses that brush to clean the grout around the toilet."
21,19,"tifu by warning a coworker about her nudes. okay, so this tifu happened about three years ago rules 1.a . i was 18 at the time male and worked at a fast-food casual restaurant and had been working there for over a year. i took pride in my work and was asked to be a national trainer for the company i politely declined due to school and so they decided to promote me instead at the location. fast-forward a week and my 17yr old female coworker asked me if she could download music from my computer onto her phone. i always kept my library updated with music so i said sure. she came over before our shift that day and synced her phone to my computer, got the music, and we were on our way. this is where the tifu began.couple days go by and my phone breaks, so i had a replacement shipped overnight. when it arrived, it didn t have service and i wasn t sure how it worked, whether it got service after being activated or if i had to call or what. but i received it around 3pm when i worked at 4. so quickly synced the new phone without service yet to my backup only to realize she overwrote my backup with hers! i didn t have time to backup my phone and resync so i took both phones to work not sure if the service would transfer while there.as i m sitting down on my break with my gm, i tell him of my dilemma joking about how i have all of her texts and contacts. his perverted mind responds with, have you seen the pictures yet? . my stupid self responded with no and opened them only to discover what appeared to be completely filled bikini lingerie pictures of her. i didn t open any of them and only saw them from the small icons. me being the person i am, i wanted to tell the girl so it wouldn t happen again to her. here s the fu although i would ve done it the same way again : i sat down with her that day and said something like this happened and i m going to go home and delete them. you have absolutely nothing to worry about, i just want you to know because it s not something to be careless about. you just need to be more careful and watch your back . she thanked me and i went on with my day.two days pass; and i get a phone call from my gm that they re going to have to let me go. i was so confused it just didn t make sense. he said it was for eing a jerk at work. yes, those were his words and what was written on my termination report. he followed it with i don t know if you have her coworker s pictures, but i would delete them before anyone else gets involved . come to find out... she felt embarrassed, told her mom, and her mom came in claiming i had nudes of her and was harassing her with them. the gm knew the truth but was the reason anyone ever saw them. so, i got fired so i would keep my mouth shut. ",26,53,warning an underage coworker about sending nudes ,i got fired from my job by my gm for warning my underage coworker about having nudes on your phone. only knew about the nudes because my gm suggested i opened them. ,53,0.910000026,"fast-forward a week and my 17yr old female coworker asked me if she could download music from my computer onto her phone. but i received it around 3pm when i worked at 4. so quickly synced the new phone without service yet to my backup only to realize she overwrote my backup with hers  i didn 't have time to backup my phone and resync so i took both phones to work not sure if the service would transfer while there.as i 'm sitting down on my break with my gm, i tell him of my dilemma joking about how i have all of her texts and contacts. here 's the fu although i would 've done it the same way again i sat down with her that day and said something like this happened and i 'm going to go home and delete them. he followed it with i don 't know if you have her coworker 's pictures, but i would delete them before anyone else gets involved .","fast-forward a week and my 17yr old female coworker asked me if she could download music from my computer onto her phone. i didn 't have time to backup my phone and resync so i took both phones to work not sure if the service would transfer while there.as i 'm sitting down on my break with my gm, i tell him of my dilemma joking about how i have all of her texts and contacts. here 's the fu although i would 've done it the same way again i sat down with her that day and said something like this happened and i 'm going to go home and delete them. she thanked me and i went on with my day.two days pass and i get a phone call from my gm that they 're going to have to let me go. he followed it with i don 't know if you have her coworker 's pictures, but i would delete them before anyone else gets involved .","fast-forward a week and my 17yr old female coworker asked me if she could download music from my computer onto her phone. she came over before our shift that day and synced her phone to my computer, got the music, and we were on our way. i didn 't have time to backup my phone and resync so i took both phones to work not sure if the service would transfer while there.as i 'm sitting down on my break with my gm, i tell him of my dilemma joking about how i have all of her texts and contacts. here 's the fu although i would 've done it the same way again i sat down with her that day and said something like this happened and i 'm going to go home and delete them. he followed it with i don 't know if you have her coworker 's pictures, but i would delete them before anyone else gets involved ."
