,index,documents,num_comments,score,title,tldr,ups,upvote_ratio,LCS,COSINE,TFIDF
8,27694,"this happened only minutes ago.the graphics card in my old ps2 decided it wanted to give up on me recently, so i decided to replace it when i had a little extra cash. i was out browsing different sites like craigslist and the like, when i stumbled upon the ps2 mentioned in the title. it looked like a great deal at the time. 25 to buy it from this guy, whereas a secondhand store in town was selling them for around 45 to 60.at the time, this seemed like a no-brainer.now, i should preface this by saying that i have a strange faith in the honesty of others. benefit of the doubt and all that noise. after all, the car i drive now is one i bought from a guy on the internet, and it runs great for something that is 27 years old. why should this be any different?starting to sound like a mistake yet?if the answer is no, then have no fear. that is almost certainly about to change. the model the seller advertised on letgo was one of the larger black brick models. like, the first generation ones. when i finally met the seller, we had a brief handshake and exchange. when he showed me the goods, it was actually one of the slim and silver ps2 s from later in the console s production run. he told me he had already sold the larger one.my first instinct, as many logical redditors would tell me, is that i should have walked away when i saw i was being sold something that was improperly advertised. unfortunately for me and i guess, fortunately for the rest of you reading this , i was not in the most logical mood. it was kind of a shitty drive to a pretty sketchy part of town, and it had already been a long morning. i just wanted to get this thing and go home.back at the ole ranch, i hooked up the console, slapped in kingdom hearts ii, and got ready to enjoy the rest of my day. i m off work and done with class, what else would i do with my evening, right? i was pretty happy with my life until i realized i had been waiting for five or so minutes and the disc wasn t reading. strange, but not altogether discouraging. i slapped in another game that i new for sure was working. didn t read. i repeated this several times with discs i knew would work; same story.now i m starting to get slightly pissed. i m sure you can see where this next part is going.i open up the app to message the seller and let him know he had sold me a defective console. not so much to my surprise, he had blocked me. i ve now got no way to contact him. of course not, he just took me for a fucking ride. all i could do at that point was report him and live in my shame. that, or i could get onto youtube and try to find a fix for a disc-read error. i picked the latter option and went on my merry way. after a video about a quick mod i could make to the system, i was feeling pretty confident that i was going to get the last laugh on this one.oh golly gee fuck was i wrong.now at this point, i begin to tumble from my perch of the high and mighty, and start snowballing right down that tall fucking mountain. i manage to get the appropriate screws out and pry that bad boy open. it s putting up a little more of a fight than i saw in the videos, but why wouldn t it? it was never meant to be opened this way in the first place. with a little elbow grease, it starts to give. i m also starting to spot a bit of rust in one of the memory card slots. a bit annoying, but the other one was working a few minutes ago so i can live with that. the further i get it open, the more rust i see on some more critical pieces. i m sweating again, but holding out hope. finally, the plastic casing comes free, and i experience the joy of a man that is working with his own two hands to solve a problem.i experience this joy for maybe a second and a half.you see, after prying the top casing off of the console, the bottom half sort of clattered back down onto the desk. the first thing i notice is that the inside is covered in rust. the second thing i notice is that some of the rust is moving.oh, that s not all rust. ohsonofabitchthosearefuck-motheringcockroaches. do you know that scene in raiders of the lost ark where indiana jones is like, snakes. why did it have to be snakes? that was me. except with cockroaches. they are the one insect that fill me with more disgust than anything else. and now they re crawling on my hands. and these are the quick little tiny ones that don t give two fucks about whether you ve stepped on them or not. i threw that whole console on the ground post haste, which only made them more riled up.they re getting everywhere now. i m yelling for help to my roommates and stomping the ground like a fucking mad man in a fit of terrified panic. you would think that something caught fire with the way i was yelling which is what my roommate said he thought had happened , but no, just cockroaches. tiny, 25 freaks of nature. eventually i managed to eradicate most of the insect horde with stomping and shouting alone, at which point i grabbed a can of raid from the laundry room and finished the job.at least, i hope i finished the job. i m fairly certain there are at least two of those little fuckers still running around under the bed, but at this point i m a little too emotionally drained to care. i also get the extreme pleasure of wallowing in the fact that i basically just paid 25 to get covered in my least favorite living thing on the planet. jesus, it s only 3 in the afternoon and i already need a stiff drink. edit: hi, reddit! i just wanted to say many thanks for the gold and all the offers for cockroach-free playstations! warms my heart, and i m super happy you guys enjoyed my writing as well. happy redditing! ",2662,42613,buying a used playstation 2 on letgo that caused me to face my worst fear. ,"i bought a used ps2 online, opened it up to fix it, and got covered in cockroaches. ",42613,0.870000005," 25 to buy it from this guy, whereas a secondhand store in town was selling them for around 45 to 60.at the time, this seemed like a no-brainer.now, i should preface this by saying that i have a strange faith in the honesty of others. he told me he had already sold the larger one.my first instinct, as many logical redditors would tell me, is that i should have walked away when i saw i was being sold something that was improperly advertised. i just wanted to get this thing and go home.back at the ole ranch, i hooked up the console, slapped in kingdom hearts ii, and got ready to enjoy the rest of my day. i repeated this several times with discs i knew would work same story.now i 'm starting to get slightly pissed. i 'm sure you can see where this next part is going.i open up the app to message the seller and let him know he had sold me a defective console. after a video about a quick mod i could make to the system, i was feeling pretty confident that i was going to get the last laugh on this one.oh golly gee fuck was i wrong.now at this point, i begin to tumble from my perch of the high and mighty, and start snowballing right down that tall fucking mountain. finally, the plastic casing comes free, and i experience the joy of a man that is working with his own two hands to solve a problem.i experience this joy for maybe a second and a half.you see, after prying the top casing off of the console, the bottom half sort of clattered back down onto the desk. the second thing i notice is that some of the rust is moving.oh, that 's not all rust. ohsonofabitchthosearefuck-motheringcockroaches. i 'm yelling for help to my roommates and stomping the ground like a fucking mad man in a fit of terrified panic. you would think that something caught fire with the way i was yelling which is what my roommate said he thought had happened , but no, just cockroaches. i 'm fairly certain there are at least two of those little fuckers still running around under the bed, but at this point i 'm a little too emotionally drained to care.","it looked like a great deal at the time.  25 to buy it from this guy, whereas a secondhand store in town was selling them for around 45 to 60.at the time, this seemed like a no-brainer.now, i should preface this by saying that i have a strange faith in the honesty of others. why should this be any different starting to sound like a mistake yet if the answer is no, then have no fear. he told me he had already sold the larger one.my first instinct, as many logical redditors would tell me, is that i should have walked away when i saw i was being sold something that was improperly advertised. i 'm off work and done with class, what else would i do with my evening, right  i repeated this several times with discs i knew would work same story.now i 'm starting to get slightly pissed. after a video about a quick mod i could make to the system, i was feeling pretty confident that i was going to get the last laugh on this one.oh golly gee fuck was i wrong.now at this point, i begin to tumble from my perch of the high and mighty, and start snowballing right down that tall fucking mountain. a bit annoying, but the other one was working a few minutes ago so i can live with that. finally, the plastic casing comes free, and i experience the joy of a man that is working with his own two hands to solve a problem.i experience this joy for maybe a second and a half.you see, after prying the top casing off of the console, the bottom half sort of clattered back down onto the desk. i 'm fairly certain there are at least two of those little fuckers still running around under the bed, but at this point i 'm a little too emotionally drained to care. i also get the extreme pleasure of wallowing in the fact that i basically just paid 25 to get covered in my least favorite living thing on the planet.","this happened only minutes ago.the graphics card in my old ps2 decided it wanted to give up on me recently, so i decided to replace it when i had a little extra cash. i was out browsing different sites like craigslist and the like, when i stumbled upon the ps2 mentioned in the title.  25 to buy it from this guy, whereas a secondhand store in town was selling them for around 45 to 60.at the time, this seemed like a no-brainer.now, i should preface this by saying that i have a strange faith in the honesty of others. like, the first generation ones. i was pretty happy with my life until i realized i had been waiting for five or so minutes and the disc wasn 't reading. i 'm sure you can see where this next part is going.i open up the app to message the seller and let him know he had sold me a defective console. the first thing i notice is that the inside is covered in rust. the second thing i notice is that some of the rust is moving.oh, that 's not all rust. ohsonofabitchthosearefuck-motheringcockroaches. and these are the quick little tiny ones that don 't give two fucks about whether you 've stepped on them or not. i 'm yelling for help to my roommates and stomping the ground like a fucking mad man in a fit of terrified panic. you would think that something caught fire with the way i was yelling which is what my roommate said he thought had happened , but no, just cockroaches."
9,31798,"i ve been a self-employed confectioner for the past two years and i recently started trying to get back into one of those fancy jobs with an office thingy again. i should also mention that for almost ten years i ve used the same handle across multiple social media platforms. it s by no means a secret identity, but it s also not explicitly connected to my real name. or so i thought. i had been happily emailing my resume and cover letters to many potential employers when i received this email from one that i was particularly excited about: i have to say when titty boobowitz appeared in my inbox i got quite a chuckle, and had to figure out where that came from! your twitter profile is great - so much personality! i look forward to reviewing your application and will be in touch shortly. ooops. my stomach fell right out of my ass when i read that. and of course the most recent thing i had tweeted was just a stream of swear words. i tried to do damage control, but i did not have high expectations. today i finally received the follow up you re not moving on to the interview process email. edit: just because i didn t make it clear - i emailed a gracious response to the person who does the hiring to let her know that it was my unintentional, embarrassing oversight and i appreciated the heads up. we had a warm back and forth, it was a positive experience overall. i m relieved to know that this kind of thing happens to tons of idiots like me. at least i didn t put attention to detail anywhere in my resume. ",1604,41247,applying for jobs for the past month as titty boobowitz ,"somewhere along the line while i was connecting social media accounts to my email, my real name was changed to titty boobowitz in gmail and i never noticed. then i attempted job hunting. no wonder i got no responses. ",41247,0.889999986,"i 've been a self-employed confectioner for the past two years and i recently started trying to get back into one of those fancy jobs with an office thingy again. i had been happily emailing my resume and cover letters to many potential employers when i received this email from one that i was particularly excited about i have to say when titty boobowitz appeared in my inbox i got quite a chuckle, and had to figure out where that came from   edit just because i didn 't make it clear - i emailed a gracious response to the person who does the hiring to let her know that it was my unintentional, embarrassing oversight and i appreciated the heads up.","i 've been a self-employed confectioner for the past two years and i recently started trying to get back into one of those fancy jobs with an office thingy again. i had been happily emailing my resume and cover letters to many potential employers when i received this email from one that i was particularly excited about i have to say when titty boobowitz appeared in my inbox i got quite a chuckle, and had to figure out where that came from  today i finally received the follow up you 're not moving on to the interview process email.","i should also mention that for almost ten years i 've used the same handle across multiple social media platforms. i had been happily emailing my resume and cover letters to many potential employers when i received this email from one that i was particularly excited about i have to say when titty boobowitz appeared in my inbox i got quite a chuckle, and had to figure out where that came from  i 'm relieved to know that this kind of thing happens to tons of idiots like me."
10,14224,"this happened some hours ago. i was on google play, searching for some games to try, because after buying them, i could refound them. here it comes the problem: i bought surgeon simulator, and after having downloaded it and played for 3 minutes, the refound button is unavable. i ask myself what could be the reason, and i discovered that i have already done this trick with this game. so i wasted 5 xe2 x82 xac ",10,0,abusing refund requests ,"bought a game, can t refund, money wasted ",0,0.239999995,"i was on google play, searching for some games to try, because after buying them, i could refound them.","i ask myself what could be the reason, and i discovered that i have already done this trick with this game.","i was on google play, searching for some games to try, because after buying them, i could refound them."
11,14228,so my mom drives a pretty expensive car audi q7 . so we were moving this past weekend and there was the moving truck in front of my driveway. i in my stupid head thought i could fit in through this small space between the truck and the mailbox which is made of bricks. lo and behold my idiotic self let the side of ther car plow through the mailbox and knock it down. so yup thats that and i got my ass kicked. ,2,0,crashing my moms car ,"fucked car doors, ass kicked by mom. ",0,0.5,i in my stupid head thought i could fit in through this small space between the truck and the mailbox which is made of bricks.,i in my stupid head thought i could fit in through this small space between the truck and the mailbox which is made of bricks.,lo and behold my idiotic self let the side of ther car plow through the mailbox and knock it down.
12,14525,"like many other posts here, this didn t happen today. it happened about 16 years ago when i was 7. my dad used to work for the department of transportation and every year they host a ring your daughter to work day and i was more than excited to go. the day started out great, we woke up early, i dressed up, we went to starbucks and while waiting for the redline we looked for mice by the tracks. we get to the office, i sign in and get a name tag. my dad introduces me to his boss daughter, we ll call her pip pretty in pink . i hated her. she wore pink and brought purses for us to play with. i am not girly and this is the last thing i want to be doing. after and hour they break us up into groups and thankfully i m not in hers.activities include going outside and playing with gpss, watching a screen of all the airplanes in the sky at that exact moment, learning how to make a website and, my favorite, learning how to drive a train. we eventually break for lunch but i have to take a shit. i tell my dad and he directs me to the bathroom, down the hall and to the left. i get in the bathroom and take a perfect shit. awesome, no one will know. i go to flush and can t figure out how. me being so young i m looking for a handle of some sort and can t find one. the only other thing i see is a string on the wall. that has to be how i flush it, right? wrong. i pull the string and an alarm sounds. fuck, fuck, fuck. i don t know what to do so i head back to my dad s office. as i m walking down the hall with the alarm blaring i notice everyone is getting out of their chairs and heading for the hallway to see what the noise is. i panic and break in to a full out sprint to my dad. i turn around to see if anyone is following and i notice heads poking out of offices looking towards the sound then looking at me. i get to my dad and explain what happened and of course he starts laughing. we head back to the bathroom and are greeted by a security guard, emt and a small crowd, pip included. come to find out i pulled the sting for people who fall and can t get back up. must be an easy fix, right? of course not. i broke it. usually you just pull the sting again and the alarm will stop but this doesn t work. everyone is in the bathroom trying to turn the alarm off and there s my shit just chillin. the front desk had to be called and we needed someone to come up and help turn the alarm off. needless to say i didn t go to another ring your daughter to work day and pip and i never became friends. ",15,91,taking a shit while at ring your daughter to work day . ,took an alarming shit at my dad s office. ,91,0.939999998,"it happened about 16 years ago when i was 7. my dad used to work for the department of transportation and every year they host a ring your daughter to work day and i was more than excited to go. as i 'm walking down the hall with the alarm blaring i notice everyone is getting out of their chairs and heading for the hallway to see what the noise is. i turn around to see if anyone is following and i notice heads poking out of offices looking towards the sound then looking at me. we head back to the bathroom and are greeted by a security guard, emt and a small crowd, pip included. everyone is in the bathroom trying to turn the alarm off and there 's my shit just chillin. needless to say i didn 't go to another ring your daughter to work day and pip and i never became friends.'","after and hour they break us up into groups and thankfully i 'm not in hers.activities include going outside and playing with gpss, watching a screen of all the airplanes in the sky at that exact moment, learning how to make a website and, my favorite, learning how to drive a train. me being so young i 'm looking for a handle of some sort and can 't find one. i turn around to see if anyone is following and i notice heads poking out of offices looking towards the sound then looking at me. come to find out i pulled the sting for people who fall and can 't get back up. the front desk had to be called and we needed someone to come up and help turn the alarm off. needless to say i didn 't go to another ring your daughter to work day and pip and i never became friends.'","it happened about 16 years ago when i was 7. my dad used to work for the department of transportation and every year they host a ring your daughter to work day and i was more than excited to go. my dad introduces me to his boss ' daughter, we 'll call her pip pretty in pink . that has to be how i flush it, right  i don 't know what to do so i head back to my dad 's office. usually you just pull the sting again and the alarm will stop but this doesn 't work. everyone is in the bathroom trying to turn the alarm off and there 's my shit just chillin."
13,31778,"tifu but technically this happened yesterday night early morning.. important note, i broke my hand punching a mailbox when i was drunk and i have a neon orange cast halfway up my arm but i went with my family to a fishing lodge to attempt to fish some awesome rivers and streams in eastern washington. we left tuesday and stayed until sunday today and then drove home. well at the same time these wonderful girls decided to have their bachelorette party..well me being 18 they viewed me as a juicy snack for their cougar claws and as i was walking by their rental house they invited me in. once i went in i was literally forced to eat some food doesn t sound too bad until it happens and given copious amounts of alcohol as they drew on my traffic cone orange cast. at this stage i was drunk and confident enough to show these women i knew how to party. more shots and beers were had and we were all having a splendid time when we got an invitation to go get smashed down by the river. we all obliged and got progressively more drunk. and then i saw her. black hair, brown eyes, curvy not fat, actually curvy . she came over to me and started to ask questions like how d you break your hand, how old are you, etc..she was 29 and i was 18. we started drinking some grey goose and it escalated from there. we started making out and went back to the house. this is where i fuckup it s like 3am at this point and she wants to have some fun. i walk outside in my drunken stupor and come face to face with her sober, pregnant, bitchy friend who tells me to leave. so i go back inside and walk out the back not understanding what i just did until my girl comes out and says we can t bang in the house. drunk me decides i don t give a fuck and we should schmang inside anyways. she keeps telling me this and she agrees to say goodnight and hit the hay. i go back home after some kisses and unleash an ungodly torrent of piss from all the alcohol i d been slurpin down. i get a text from the girl saying to come over and we proceed to have glorious laundry room floor sex for an hour and a half..we finish up and we say goodnight and i go home at 4:30am. this morning i wokeup with fucked knees from the tile floor we were schmangin on but 69 69 would do again. it was a good night indeed. ",4,0,going outside while drunk at a bachelorette party ,"hijacked a bachelorette party, replaced my blood with alcohol, banged a bridesmaid..all while being 18. ",0,0.5,"tifu but technically this happened yesterday night early morning.. important note, i broke my hand punching a mailbox when i was drunk and i have a neon orange cast halfway up my arm but i went with my family to a fishing lodge to attempt to fish some awesome rivers and streams in eastern washington. so i go back inside and walk out the back not understanding what i just did until my girl comes out and says we can't bang in the house. i get a text from the girl saying to come over and we proceed to have glorious laundry room floor sex for an hour and a half..we finish up and we say goodnight and i go home at 4 30am.","she came over to me and started to ask questions like how'd you break your hand, how old are you, etc..she was 29 and i was 18. we started drinking some grey goose and it escalated from there. so i go back inside and walk out the back not understanding what i just did until my girl comes out and says we can't bang in the house. i get a text from the girl saying to come over and we proceed to have glorious laundry room floor sex for an hour and a half..we finish up and we say goodnight and i go home at 4 30am.",we started making out and went back to the house. so i go back inside and walk out the back not understanding what i just did until my girl comes out and says we can't bang in the house. i get a text from the girl saying to come over and we proceed to have glorious laundry room floor sex for an hour and a half..we finish up and we say goodnight and i go home at 4 30am.
