,index,documents,num_comments,score,title,tldr,ups,upvote_ratio,LCS,COSINE,TFIDF
0,5900,"this happened to me yesterday and i m still baffled.it all started when i posted a comparison picture of a dog which looks like the actor william h. macy. i couldn t stop laughin over it but i never thought it would gain so much attention. however it ended up on the front page with much more upvotes i could have imagined. this alone was crazy for me because i never expected to have a submission on the front page.when i checked my phone the next morning my reddit inbox exploded over the sheer amount of youtube links i received. i checked them and found my submission on the latest jimmy kimmel show with reddit co-founder alexis ohanian. i was mind blown over this.they proceeded talking over reddit users and jimmy ended up checking my history. well i hardly ever post filthy stuff but i commented on a nsfw tifu a few days ago and i think jimmy thought it was my submission at the short glance he took.keep in mind they even named and showed my username - he made it look like there was a lot of filthy stuff going on in my history so this was quite embarrassing for me and im getting a lot of crazy messages now.i don t know if this perfectly qualifies for a tifu but on the one hand it felt like one, when he revealed my history with filthy stuff as he said. on the other hand it s just cool and a story to tell. however i regret nothing! link to the video: URL starts at 2:10 oh and thanks for the gold! things are going so fast here i didnt even see it until now. thank you unknown and kind strangers! ",2715,85249,having my reddit history revealed by jimmy kimmel live on tv ,jimmy kimmel had reddit co-founder alexis ohanian as a guest. they ended up browsing my reddit history and jimmy made it look like there s filthy stuff going on. ,85249,0.879999995,"this alone was crazy for me because i never expected to have a submission on the front page.when i checked my phone the next morning my reddit inbox exploded over the sheer amount of youtube links i received. well i hardly ever post filthy stuff but i commented on a nsfw tifu a few days ago and i think jimmy thought it was my submission at the short glance he took.keep in mind they even named and showed my username - he made it look like there was a lot of filthy stuff going on in my history so this was quite embarrassing for me and im getting a lot of crazy messages now.i don't know if this perfectly qualifies for a tifu but on the one hand it felt like one, when he revealed my history with 'filthy stuff' as he said.","however it ended up on the front page with much more upvotes i could have imagined. well i hardly ever post filthy stuff but i commented on a nsfw tifu a few days ago and i think jimmy thought it was my submission at the short glance he took.keep in mind they even named and showed my username - he made it look like there was a lot of filthy stuff going on in my history so this was quite embarrassing for me and im getting a lot of crazy messages now.i don't know if this perfectly qualifies for a tifu but on the one hand it felt like one, when he revealed my history with 'filthy stuff' as he said.","i was mind blown over this.they proceeded talking over reddit users and jimmy ended up checking my history. well i hardly ever post filthy stuff but i commented on a nsfw tifu a few days ago and i think jimmy thought it was my submission at the short glance he took.keep in mind they even named and showed my username - he made it look like there was a lot of filthy stuff going on in my history so this was quite embarrassing for me and im getting a lot of crazy messages now.i don't know if this perfectly qualifies for a tifu but on the one hand it felt like one, when he revealed my history with 'filthy stuff' as he said."
1,34594,"edit: i got an ama thread now. help me: URL tifu didn t happen today but quite a few years back. for obvious reasons i m using a throwaway account as my family knows my main reddit username. -------------------------anyway, around 8 years back i lived in northern mozambique, a coastal southern african country with quite a warm climate. my mother at the time was going through a health nut phase and only buying foods she deemed healthy enough. one of these was coconuts. she would buy several coconuts a week to use in food from the local market.anyway, being a horny teenager i fapped in regular intervals. unfortunately there was some severely stressful examinations coming up for me and as such my fapping reached a higher peak then usual and i was feeling pretty sexually frustrated. one day i hear that my mother is going to be out for pretty much the entire afternoon. horny me decides that it would be a fantastic idea to fuck a coconut. honestly to this day i can t fathom why i thought that would be a good idea but my train of thought back then was clearly somewhat clogged. i end up grabbing the coconut drill and through 20ish minutes of concerted effort end up creating a hole large enough for me to stick my porker into. i decide it requires some lube and grab the nearest slippery thing some butter before shoving it into the coconut followed shortly by my meat. i fuck the coconut and it actually feels pretty damn good so i blow my load, shove the coconut under my bed and continue about my day. --------------------for the next week the coconut is my saviour. whenever i want to get off i simply take it out and fuck it in its delightfully tight hole made better each time by accumulating volumes of my semen and butter acting as a lubricant. it s heaven. now before i continue i d best mention that at the time our area was experiencing quite humid, muggy weather which exacerbated an already existing fly problem. disgustingly fat, bloated flies were commonly found around our house and the exterminators couldn t really do anything because it was a localized area problem that would go away in the winter . about a week and a bit after the initial coconut fuck i had been using it pretty much every day since then i begin to notice a few more flies than usual as well as an odd, unpleasant smell about my room. must be the coconut right? so i decide that i ll fuck it once more before i throw it out and get a new one. worst mistake i have ever made. you see, the reason for the increased number of flies was that the coconut was evidently, in hindsight, a nearly perfect place to lay eggs. as i penetrate the coconut one last time i begin to feel a strange wriggling sensation. puzzled, i pull my cock out to discover that it is covered in rotted and moldy butter and semen and teeming with tiny fucking maggots . they were wriggling all over my dick head and some were even trying to force their way up into my urethra. i screamed, and threw the coconut against the wall which made the situation worse by spilling the contents. hours of vigorous cock scrubbing, vomiting, and cleaning the remnants were spent reflecting on what the fuck i was doing with my life. never again. never again. edit: jesus this exploded. i m glad my maggoty experience made some people laugh, because i sure cry everytime i think back to it.edit 2: rip inboxedit 3: thanks for the gold. it eases my shame a little. i m thinking of doing an ama for you more curious individuals. maybe if the post hits 10k - it s quite uncomfortable to discuss though as the visceral memories come backedit 4: my shame has never been this large. 47.1k upvotes. my story of coconut fucking is now permanently etched into reddit s history. lord save me. ",3825,81547,cumming into a coconut ,don t fuck coconuts. ,81547,0.8999999759999999,"i end up grabbing the coconut drill and through 20ish minutes of concerted effort end up creating a hole large enough for me to stick my porker into. i decide it requires some lube and grab the nearest slippery thing some butter before shoving it into the coconut followed shortly by my meat. i fuck the coconut and it actually feels pretty damn good so i blow my load, shove the coconut under my bed and continue about my day. about a week and a bit after the initial coconut fuck i had been using it pretty much every day since then i begin to notice a few more flies than usual as well as an odd, unpleasant smell about my room.  you see, the reason for the increased number of flies was that the coconut was evidently, in hindsight, a nearly perfect place to lay eggs. as i penetrate the coconut one last time i begin to feel a strange wriggling sensation. my story of coconut fucking is now permanently etched into reddit 's history.","one day i hear that my mother is going to be out for pretty much the entire afternoon. honestly to this day i can 't fathom why i thought that would be a good idea but my train of thought back then was clearly somewhat clogged. whenever i want to get off i simply take it out and fuck it in its delightfully tight hole made better each time by accumulating volumes of my semen and butter acting as a lubricant. disgustingly fat, bloated flies were commonly found around our house and the exterminators couldn 't really do anything because it was a localized area problem that would go away in the winter . about a week and a bit after the initial coconut fuck i had been using it pretty much every day since then i begin to notice a few more flies than usual as well as an odd, unpleasant smell about my room. as i penetrate the coconut one last time i begin to feel a strange wriggling sensation. maybe if the post hits 10k - it 's quite uncomfortable to discuss though as the visceral memories come backedit 4 my shame has never been this large.","edit i got an ama thread now. horny me decides that it would be a fantastic idea to fuck a coconut. i fuck the coconut and it actually feels pretty damn good so i blow my load, shove the coconut under my bed and continue about my day. --------------------for the next week the coconut is my saviour. about a week and a bit after the initial coconut fuck i had been using it pretty much every day since then i begin to notice a few more flies than usual as well as an odd, unpleasant smell about my room. must be the coconut right  as i penetrate the coconut one last time i begin to feel a strange wriggling sensation."
