,index,documents,num_comments,score,title,tldr,ups,upvote_ratio,LCS,COSINE,TFIDF
4,4506,"i m in my third year of university taking engineering so this is a little extra embarrassing considering my streak of never being that person in the wrong class. to start the semester i ended up missing the first week of school because i was on a last minute trip with my friends. it was completely unplanned and actually a few of my friends who had graduated helped chip to buy my ticket since i technically couldn t afford to go. future me will hate past me for going because i used my student loans to go... but thats a different issue. anyway, i came into class a week late and it is scheduled for tuesdays and thursdays at 7-8:15pm. on both those days i have classes all day until 2pm so i usually go home to eat and grab a snooze before the night class. so my first tuesday home i ended up over sleeping and turning up to class five minutes late. so as part of my degree i have to take microeconomics which all i knew about it previously was it s about the economy and money. when i get to class they re talking about supply and demand curves shifting so i just take a spot in the back not thinking twice.this goes on for 3.5 weeks. i came to class. took notes. then did the weekly assignments. on the course syllabus it had a date for the midterm which is febuary 1st. so the class before the exam, january 30th, i decided to stick around after class and ask some questions. now i was doing all the assignments and thought the course material was relevant but it was all theory based while the class was heavy math based. i understood what was going on but there was obviously some disconnect. i explained my concerns about the midterm to the prof and the conversation went like this: explains above about material prof: what do you mean theory? all the assignments are filled with math. are you using launchpad? me: no the assignments are online. like the website we bought the textbook from. whats lauchpad? prof: pardon? i don t have a textbook for this course. me: it literally says in the syllabus, look! shows syllabus prof: wait, what class are you supposed to be in? me: what do you mean...? this is econ 202 right? prof starts laughing prof: haha this is econ 301, you have to take 202 before you take my class. this is a new one, i ve never experienced this before. me: well this is awkward. i better go see my actual teacher and explain. i then just grabbed my stuff real quick and sprinted through campus to go explain the situation to the other guy. i caught him just as he was leaving lecture and explain my predicament. even showed him my econ 301 notes to prove i couldn t make this shit up. he just laughed and said the same thing this is a new one for me. turns out all the assignments for both classes were due the same day. same with the midterms. they were relevant because it was obviously a level above what i was supposed to be doing and the only thing i got wrong was the building code. they were both classroom 112, just different buildings. so basically i just spent the last 2 nights forgetting everything from this class all month and learning the real material. wish me luck tomorrow! edit: well shit, went to sleep and woke up from a friend texting me saying you made the front page you motherfucker hahahahahaha . the exam is in a couple hours and i will update you on my grade but to clear up some of the comments:1. ya, the trip wasn t the smartest but i had fun and went to tiesto s birthday in vegas amongst other kool stuff. life goes on.2. i was doing the assignments for the actual class with some help from my good buddy google and i had the actual textbook pirated, no one buys textbooks c mon . so i do have a grasp of whats going on.. kinda. he did everything on the board and there were online notes but i figured you did practical application in class and the online notes actually for my 202 class were for reference purposes. 3. i highly doubt i ll fail the course or the midterm. it s amazing how much you can learn in 24 hours with enough caffeine and fear in your belly. i ve made it through almost 3 years of engineering so i m sure it will turn out fine. it ll be a funny story at grad when i get my ring.thanks for all the support too. : making the front page of reddit just adds to how sweet 2018 s been no sarcasm and this is just a minor set back.edit 2: just got back from the exam.. i didn t crush it but there is no way i didn t pass. it was twenty multiple choice and 2 five mark short answer questions. the prof also stopped me leaving the exam and said i usually don t tell students this until before the 2nd midterm but if you score better on the final and second midterm i will take the average to make up that first exam. so all in all i survived and live to fight another day.just wanted to say thanks for all the kind words and hilarious stories. i will start going through my inbox and try to reply to some people. in the words of one of my good friends giving me advice in first year eng: literally everyone in eng at multiple, multiple points feel like their gonna fail and life s over. but somehow they keep going and that is the circle of eng life. - czp.s: for textbook help... ig: redditecon202 ",2466,48085,sitting in the wrong class for an entire month and finding out a day before the first midterm. ,i was in the wrong econ class for an entire month until i finally realized. then had to cram for 2 nights for a midterm. crazy coicidences all around. ,48085,0.8999999759999999,"i 'm in my third year of university taking engineering so this is a little extra embarrassing considering my streak of never being that person in the wrong class. so my first tuesday home i ended up over sleeping and turning up to class five minutes late. when i get to class they 're talking about supply and demand curves shifting so i just take a spot in the back not thinking twice.this goes on for 3.5 weeks. now i was doing all the assignments and thought the course material was relevant but it was all theory based while the class was heavy math based. i explained my concerns about the midterm to the prof and the conversation went like this explains above about material prof what do you mean theory   prof starts laughing prof haha this is econ 301, you have to take 202 before you take my class. turns out all the assignments for both classes were due the same day. so basically i just spent the last 2 nights forgetting everything from this class all month and learning the real material. i was doing the assignments for the actual class with some help from my good buddy google and i had the actual textbook pirated, no one buys textbooks c 'mon . he did everything on the board and there were online notes but i figured you did practical application in class and the online notes actually for my 202 class were for reference purposes. the prof also stopped me leaving the exam and said i usually don 't tell students this until before the 2nd midterm but if you score better on the final and second midterm i will take the average to make up that first exam.  in the words of one of my good friends giving me advice in first year eng literally everyone in eng at multiple, multiple points feel like their gonna fail and life 's over.","i 'm in my third year of university taking engineering so this is a little extra embarrassing considering my streak of never being that person in the wrong class. future me will hate past me for going because i used my student loans to go... but thats a different issue. when i get to class they 're talking about supply and demand curves shifting so i just take a spot in the back not thinking twice.this goes on for 3.5 weeks. so the class before the exam, january 30th, i decided to stick around after class and ask some questions. i better go see my actual teacher and explain. even showed him my econ 301 notes to prove i couldn 't make this shit up. so basically i just spent the last 2 nights forgetting everything from this class all month and learning the real material. i 've made it through almost 3 years of engineering so i 'm sure it will turn out fine.  making the front page of reddit just adds to how sweet 2018 's been no sarcasm and this is just a minor set back.edit 2 just got back from the exam.. i didn 't crush it but there is no way i didn 't pass. the prof also stopped me leaving the exam and said i usually don 't tell students this until before the 2nd midterm but if you score better on the final and second midterm i will take the average to make up that first exam.  so all in all i survived and live to fight another day.just wanted to say thanks for all the kind words and hilarious stories. in the words of one of my good friends giving me advice in first year eng literally everyone in eng at multiple, multiple points feel like their gonna fail and life 's over.","i came to class. so the class before the exam, january 30th, i decided to stick around after class and ask some questions. now i was doing all the assignments and thought the course material was relevant but it was all theory based while the class was heavy math based. i explained my concerns about the midterm to the prof and the conversation went like this explains above about material prof what do you mean theory   me no the assignments are online.  shows syllabus prof wait, what class are you supposed to be in   prof starts laughing prof haha this is econ 301, you have to take 202 before you take my class. i was doing the assignments for the actual class with some help from my good buddy google and i had the actual textbook pirated, no one buys textbooks c 'mon . he did everything on the board and there were online notes but i figured you did practical application in class and the online notes actually for my 202 class were for reference purposes. the prof also stopped me leaving the exam and said i usually don 't tell students this until before the 2nd midterm but if you score better on the final and second midterm i will take the average to make up that first exam.  in the words of one of my good friends giving me advice in first year eng literally everyone in eng at multiple, multiple points feel like their gonna fail and life 's over. but somehow they keep going and that is the circle of eng life. "
5,33209,"so my dad has had this didgeridoo in the house since he visited his sister in australia 10 years ago. my parents wanted to go out for a walk but i decided i xe2 x80 x99d eaten too much cheese and couldn xe2 x80 x99t be arsed. while they were out the internet went down so i was sort of wandering around looking for something to do when i spotted the didg. i thought to myself in all these years i xe2 x80 x99ve never actually tried to play it it xe2 x80 x99s more of a decoration and i barely take it in when i see it and maybe it xe2 x80 x99s time. i pick it up and put it to my lips. i felt like i knew what i was doing and that it was similar to playing a trumpet and wanted to play a long, loud note. i take a sharp inhale and immediately feel something hit the back of my throat. i splutter really hard and a small white globular thing comes flying out and hits the floor. at first i thought it was saliva and ignored it as i had a weird sensation in my throat and mouth. it felt like tingling to start with but grew into more of a tickle on the inside of my cheeks and a bit on my gums. i glance down at the white stuff on the floor and see several baby spiders crawling out of it and in all directions. the second i clock what xe2 x80 x99s happened i feel something tickling my top lip and slap my mouth with my hand. i have a squished spider on my lip and instantly go into panic mode. i run into the bathroom and spit repeatedly into the sink to see crushed spider bodies and some severed legs, some of which are still attached to parts of the body and are trying to drag themselves away from the plug hole. i urge several times and then frantically swill my mouth out with water. i don xe2 x80 x99t think my mouth will ever feel normal again. edit; woah gold! and front page! ta! glad you all like hate my story ",2167,46906,trying to play my dad xe2 x80 x99s didgeridoo. ,"thought i could play didgeridoo, inhaled a mouthful of spiders. ",46906,0.889999986,i thought to myself in all these years i xe2 x80 x99ve never actually tried to play it it xe2 x80 x99s more of a decoration and i barely take it in when i see it and maybe it xe2 x80 x99s time. i take a sharp inhale and immediately feel something hit the back of my throat. the second i clock what xe2 x80 x99s happened i feel something tickling my top lip and slap my mouth with my hand.,i thought to myself in all these years i xe2 x80 x99ve never actually tried to play it it xe2 x80 x99s more of a decoration and i barely take it in when i see it and maybe it xe2 x80 x99s time. i take a sharp inhale and immediately feel something hit the back of my throat. the second i clock what xe2 x80 x99s happened i feel something tickling my top lip and slap my mouth with my hand.,i thought to myself in all these years i xe2 x80 x99ve never actually tried to play it it xe2 x80 x99s more of a decoration and i barely take it in when i see it and maybe it xe2 x80 x99s time. the second i clock what xe2 x80 x99s happened i feel something tickling my top lip and slap my mouth with my hand. i don xe2 x80 x99t think my mouth will ever feel normal again. edit woah gold 
6,38348,"this happened a few years ago and i was living in zimbabwe at the time, and i was having a pretty bad day, i was going to see my auntie who lived about 400km away from me. if youre african you ll understnad that this was no small journey. so i got in my car and set off and about 3 hours into the journey i came across a dude by the side of the road who was going in the same direction, so out of the goodness of my heart i said jump in. we go to talking and he happened to be going to exact same village as me and he knew my auntie!.half an hour passes and we re making polite chit chat and reminiscing about old times in zimbabwe, when all of a sudden he tell me to pull over, so i do. he runs out of the car and starts making wretching noises, so i assume he s throwing up, its dark at this point so i cant really see much, so i go check on him first mistake .i get out and go to his side expecting him to be there but he s not.....then i here someone behind and me and before i know it im unconcious! so i wake up a couple hours later iknow this becuase the sun was coming up at this point without my car, clothes or wallet. so im thinking great. i look around and see im on some farmland wearing the giys clothes. so i start walking in no particular direction and eventually come across a settlement. i explain to them my situation and they tell me that the nearest main road is at least a good half a days walk from where i am and they dont get many cars coming through this part but they heard one last night which might be our thief . i start walking in the direction they point me in and after what felt like forever i come acroos a road, so i pitch up and start waiting, now i know most of you are thinking why not call someone, i had no phone with me and i dont have the best memory so i didnt know any numbers that would come in handy . after a couple of hours a car stops and lets me hitch i let him know the situaion and he says we re in the complete opposite direction of my intended destination but he s willing to drop me close enough to walk the rest of the way to which i thought great!its takes a good two days to get there and he drops me off and i say my goodbyes to my driver, i take down his number so i can repay him later on. at this point im starting to recoginise my surroundings, i walk for a few miles and as im getting closer to my aunties i can here a lots of singing and what appears to be a large crowd which i though was strange. im about 100 feet from the house and i see my son which again i thought was strange because he was meant to be in school at this time, but instead of running to me and hugging me as he normally does...he runs away screaming to my complete bewilderment. i get to the the gate and all of a sudden the large crowd alerted by my sons scream has stopped singing and is stood silent. my wife appears and starts to run towards me hugging and kissing me like ive been gone for months. my auntie appears and immediately faints when she sees me.i still have no clue whats going on at this point and im exhausted, so we rush to get my auntie inside and i see my picture ontop of a large box that resembles a coffin sitting in the living room....so it turns out that the guy who robbed me and made off with my car my wallet and all my clothes was in a car crash so bad that they couldnt identify the body and because the only things they could use to identify him was my wallet, they assumed it was me that had died in the crash. since there was no body of sorts they could arrange the funeral preety quickly and that is what i had stumbled upon.my son still has nightmares to this day and and my wife has told me never to pick up a hitch hiker ever again. ",2338,43986,picking up a hitchhiker and then showing up to my own funeral ,"got carjacked, robber died and family thought it was me, they arrange my funeral and i somehow manage to stumble upon my own funeral. ",43986,0.860000014,"i start walking in the direction they point me in and after what felt like forever i come acroos a road, so i pitch up and start waiting, now i know most of you are thinking why not call someone, i had no phone with me and i dont have the best memory so i didnt know any numbers that would come in handy . after a couple of hours a car stops and lets me hitch i let him know the situaion and he says we're in the complete opposite direction of my intended destination but he's willing to drop me close enough to walk the rest of the way to which i thought great its takes a good two days to get there and he drops me off and i say my goodbyes to my driver, i take down his number so i can repay him later on. my auntie appears and immediately faints when she sees me.i still have no clue whats going on at this point and im exhausted, so we rush to get my auntie inside and i see my picture ontop of a large box that resembles a coffin sitting in the living room....so it turns out that the guy who robbed me and made off with my car my wallet and all my clothes was in a car crash so bad that they couldnt identify the body and because the only things they could use to identify him was my wallet, they assumed it was me that had died in the crash.","i explain to them my situation and they tell me that the nearest main road is at least a good half a days walk from where i am and they dont get many cars coming through this part but they heard one last night which might be our thief . after a couple of hours a car stops and lets me hitch i let him know the situaion and he says we're in the complete opposite direction of my intended destination but he's willing to drop me close enough to walk the rest of the way to which i thought great its takes a good two days to get there and he drops me off and i say my goodbyes to my driver, i take down his number so i can repay him later on. im about 100 feet from the house and i see my son which again i thought was strange because he was meant to be in school at this time, but instead of running to me and hugging me as he normally does...he runs away screaming to my complete bewilderment.","i start walking in the direction they point me in and after what felt like forever i come acroos a road, so i pitch up and start waiting, now i know most of you are thinking why not call someone, i had no phone with me and i dont have the best memory so i didnt know any numbers that would come in handy . at this point im starting to recoginise my surroundings, i walk for a few miles and as im getting closer to my aunties i can here a lots of singing and what appears to be a large crowd which i though was strange. my auntie appears and immediately faints when she sees me.i still have no clue whats going on at this point and im exhausted, so we rush to get my auntie inside and i see my picture ontop of a large box that resembles a coffin sitting in the living room....so it turns out that the guy who robbed me and made off with my car my wallet and all my clothes was in a car crash so bad that they couldnt identify the body and because the only things they could use to identify him was my wallet, they assumed it was me that had died in the crash."
